ID,Title,Question,Top Answers,Score,Tags,Date
42145566,what39s the potential risk to my local network if i set port forwarding for raspberry pi,"i recently setup my rpi just for learning linux, python and some basic electric circuit for small projects. sometime i need to access to my system through internet, so i set port forwarding function to open port 22 and 80 for raspberry pi. since this is only for learning purpose, theres really nothing important and theres no sensitive data saved on this machine. so i dont worry much about the security issue. what i really worry is other than the raspberry pi, is there any risk to my other devices inside same local network? is it possibleor easy to hack those devices only from that open port?","the answer to your question, as stated is no, there is no notable risk to your other devices from those open ports to your raspberry pi. however, if someone is to compromise you, theyd need to first compromise your pi and then use that. any vulnerabilities would require that someone is able to compromise either ssh or http on the raspberry pi that there is something that they can do with that information. practically, if you have a secure ssh setup and are running your http server in a way that is secure, it is very unlikely that anyone could do anything. if they did, theyd need to compromise. if you use keys for ssh login and dont do anything nonstandard for you should be plenty good. you can also change the ssh port to run on a nonstandard port and that will obscure things slightly, though it will not change the theoretical vulnerabilities.",-1,linux;security;raspberry-pi;local-network,2017-02-09
41337381,authenticating a raspberry pi http request,"i am making a raspberry pi kiosk using chromium. the html pages will be contained on the pi and the information on the pages will be returned through ajax json. similar to an api. they make requests to my server using ssl. the information should be kept private and only allowed to be accessed by the pi. there is no login to the kiosk, its kinna a plug and play thing. what type of authentication should i use to verify that only the pi is returned the data and on one else? a rotating token stored on the pi? checking ip? static token? use apache htaccess? server is using php and mysql on apache front end is html and js stored on the pi",the simplest reliable solution is probably apache basic auth. its a perfectly acceptable solution combined with ssl as you already said youre using so the password gets encrypted. there is a setup guide here. it works very well and is easy to configure. then just use urls like this,1,javascript;php;apache;security;raspberry-pi,2016-12-27
41061282,an idea for upload data in remote database in python,"im tryng to find a solution for upload data on a remote mysql database using a python daemon. my base script use a simple query insert into.... but in top of the script there are in clear the credentials to connect on database conn mysqldb.connecthost192.168.1.123, userroot, passwdpaw0rd, dbmydb i do not want anyone reading the python script can access the database directly. i need to use python scripts on clients the server with mysql db is on cloud the clients are raspberry pi in the server i can use php","several ways 1. use mysql.cnf file mysql cnf files is a config file storing mysql credentials, if this server or client executing the script has one, you can use it like dbmysql.connecthostouthouse,dbthangs,readdefaultfile.my.cnf credentials are not in your python script anymore, but they are clear in cnf file anyway and you must have this file in the same place everywhere you want to use your script. source 2. command line argument you can parse command line arguments to get credentials from it like import sys user sys.argv1 password sys.argv2 conn mysqldb.connecthost192.168.1.123, useruser, passwdpassword, dbmydb and so execute your script with python myscript root paw0rd with this method credentials cant be found in any config file, but you have to execute it with arguments, if its a deamon it can be ok, but if you want to use it as cron by example, you will have to write credentials in crontab, so not so safe. 3. environment variables another way is to use environment variables import os conn mysqldb.connecthost192.168.1.123, useros.environmysqluser, passwdos.environmysqlpassword, dbmydb but you will have to set these variables somewhere. in .bashprofile, etcprofile or by command line. so if somebody access to user that can execute script, he can read password. 4. encoding encoding seems to be a good way to hide password, but in fact you can not really hide from someone who can access to the right user in the right server. encoded string without salt is easy to decode, some encoding methods are easy to spot and can be decoded by anyone. using a salt will make work more harder, but if somebody can access to you code, it will be easy to locate salt phrase no matter if salt is stored in environment var, in a file or directly in code. using .pyc files can be an idea too, but first, its not recommended and anybody can read content by creating a python script importing this pyc file and print what stored in. encoding credentials still is still a good thing, but encoded string can always be decoded, if your code can, somebody with access to it can too. a simple print password added in your code and regardless of the used method the password will be accessible. so you have to secure your python code, but unix users amp groups too and mysql config too.",0,php;python;mysql;security;raspberry-pi,2016-12-09
36856247,protect python code in raspberry pi,"im a few weeks away from finishing up a python project written for raspberry pi 2 b, on raspbian os. the only thing im still afraid is, how to protect my code from others? anyone can connect a screen with hdmi cable, and easily access my raspberry pi. in windows, just compile your code as executable .exe file and all done. but what should i do in linux? any suggestions would be appreciated.",,0,python;linux;security;raspberry-pi;raspbian,2016-04-26
34850588,how to send email from consumer device?,"what is the right way to send email from an consumer product? say your are developing the forgot password functionality on an app, running on a micro computer like the raspberrypi that the user can buy of the shelf? on one hand, the consumer cant be bothered to enter its own smtp credentials. on the other hand, storing the manufacturers smtp credentials is a security flaw, because the hardware with physical access can be easily hacked.","if you want to build a forgot password functionality, you should build out an api on a server that you control that has the forgot password functionality. then, you can send the email to them with the temporary reset values, and you wouldnt need to ship your smtp credentials on their device.",0,security;email;raspberry-pi;iot,2016-01-18
25657743,send video file via python,"i need to figure out how to make a script that scans for new files in a directory, and when there is a new one, sends the file via email. someone keeps stealing bikes in my apartment building! first it was my fault i for got to lock it, now the crook upgraded by cutting chains. i had it after the crook stole my second bike by cutting 12 inch airplane wire. anyway, using a raspberry pi as a motion activated security camera, i want it to send me a video file as soon as the video program finishes recording it. this is incase they steal the pi. i am looking at these examples, but i cant figure how to make the script run continuously every minute or how to make it scan a folder for a new file. how do i send attachments using smtp? ok i got it down to scanning and then trying to email. it fails when trying to attach the video file. can you help? here is the revised code the failure is msg mimemultipart typeerror lazyimporter object is not callable, line 38 import time, glob import smtplib import email.mimemultipart from email.mimebase import mimebase from email.mimetext import mimetext from email.utils import commaspace, formatdate from email import encoders, mimemultipart import os settings fromemail jose garcia ltsomerandomemailgmail.comgt loginnamesomerandomemailgmail.com loginpasswordsomerandomepassword toemail jose garcia ltsomerandomemailgmail.comgt smtpserversmtp.gmail.com smtport587 fileslocationuserssomeonedesktoptest.mp4 subjectsecurity notification def mainloop filesglob.globfileslocation put whatever path and file format youre using in there. while 1 newfilesglob.globfileslocation if lennewfilesgtlenfiles for x in newfiles if x in files printnew file detected x printabout to call send email sendmailloginname, loginpassword, toemail, fromemail, subject, gethtmlcode, x, smtpserver, smtport filesnewfiles time.sleep1 def sendmaillogin, password, to, frome, subject, text, filee, server, port assert typetolist assert typefileelist msg mimemultipart msgfrom frome msgto commaspace.jointo msgdate formatdatelocaltimetrue msgsubject subject msg.attach mimetexttext for filee in files part mimebaseapplication, octetstream part.setpayload openfilee,rb.read encoders.encodebase64part part.addheadercontentdisposition, attachment filenames os.path.basenamefilee msg.attachpart smtp smtplib.smtpsmtpserver, smtport smtp.sendmailfrome, to, msg.asstring server.setdebuglevel1 server.starttls server.ehlo server.loginlogin, password server.sendmailfrome, to, msg server.quit def gethtmlcode printabout to assemble html html lt!doctype html public w3cdtd xhtml 1.0 transitionalen html xmlns html ltbody stylefontsize12pxfontfamilyverdanagtltpgta new video file has been recorded ltpgt html ltbodygtlthtmlgt returnhtml execute loop mainloop","i finally got it working. i had to use python 2.5 to get rid of the lazyimporter error. every time a new file is added to the security folder, it gets emailed to me. logging is broken. import time, glob import smtplib from email.mimemultipart import mimemultipart from email.mimemultipart import mimebase from email.mimetext import mimetext from email.utils import commaspace, formatdate import datetime from email import encoders import os import sys settings fromemail raspberrypi security camera ltsomeonegt loginnamesomeonegmail.com loginpasswordsomething toemail jose garcia lt someonegmail.comgt smtpserversmtp.gmail.com smtport587 fileslocationuserssomeonedesktoptest. subjectsecurity notification loglogfile.txt def mainloop filesglob.globfileslocation put whatever path and file format youre using in there. while 1 f openlog, w sys.stdout teesys.stdout, f newfilesglob.globfileslocation if lennewfilesgtlenfiles for x in newfiles if x in files printstrdatetime.datetime.now new file detected x sendmailloginname, loginpassword, toemail, fromemail, subject, gettext, x, smtpserver, smtport filesnewfiles f.close time.sleep1 def sendmaillogin, password, sendto, sendfrom, subject, text, sendfile, server, port msg mimemultipart msgfrom sendfrom msgto commaspace.joinsendto msgdate formatdatelocaltimetrue msgsubject subject msg.attach mimetexttext part mimebaseapplication, octetstream part.setpayload opensendfile,rb.read encoders.encodebase64part part.addheadercontentdisposition, attachment filenames os.path.basenamesendfile msg.attachpart smtp smtplib.smtpsmtpserver, smtport smtp.setdebuglevel1 smtp.ehlo smtp.starttls smtp.loginlogin, password smtp.sendmailsendfrom, sendto, msg.asstring smtp.close def gettext text a new file has been added to the security footage folder. ntime stamp strdatetime.datetime.now returntext class teeobject def initself, files self.files files def writeself, obj for f in self.files f.writeobj execute loop mainloop || it looks like the email module has been refactored over time. this fixed the lazyimporter object not callable error for me on python 2.7 from email.mime.text import mimetext noteably it was not happy with what i thought were synonyms like import email email.mime.text.mimetext... || i use python3 and i could not for the life of me get any of these examples to work, but i was able to come up with something that works and is a whole lot simpler. import smtplib from email.message import emailmessage from email.mime.base import mimebase from email import encoders defining objects and importing files initializing video object videofile mimebaseapplication, quotoctetstreamquot importing video file videofile.setpayloadopenvideo.mkv, quotrbquot.read encoding video for attaching to the email encoders.encodebase64videofile creating emailmessage object msg emailmessage loading message information msgfrom quotpersonsendinggmail.comquot msgto quotpersonreceivinggmail.comquot msgsubject text for the subject line msg.setcontenttext that will be in the email body. msg.addattachmentvideofile, filenamequotvideo.mkvquot start smtp server and sending the email serversmtplib.smtpsslsmtp.gmail.com,465 server.loginquotpersonsendinggmail.comquot, quotsomecleverpasswordquot server.sendmessagemsg server.quit",-2,python;security;email;raspberry-pi,2014-09-04
24478583,rpi ldap netboot sd crypt,"hello everyone, i am doing a project with rpi, i want rpi to boot by internet, user login must be check with a server, and i want the sd to be encrypted. i want all of these because i do not want the information inside rpi to be hack, i want to protect all the information and the use of this by a server. is this possible? how could i do it? what do you app recommend me? i need an orientation to continue reading and investigating. best regards thank you for your help! joseluis",,0,security;encryption;ldap;raspberry-pi;nfs,2014-06-29
21869936,storing keys on user devices,"so say i have some random hardware box i send out to customers. in this case, itll be a raspberry pi inside. i want that pi to be able to connect securely to a web service that is only accessible by the raspberries that i have. each pi contains its own key that it uses to verify with the web service. in this case, think of the rpi as any other embedded user device. it boots up and just does its own thing to call home. the user doesnt enter anything. is there any way to securely store these keys on the pi? i wouldnt want people to be able to connect to the web service and verify with some keys they read off the sd card. im used to dealing with this in the context of a user providing access to the keys with a keyring or something like that, but im not sure how you could store keys on an embedded device that requires there be no user input without using some ridiculous secure bootloader scheme or something like that.","if the key must be stored on the pi somehow, and anything on the pi can be read, youre out of luck. any sort of key or algorithm you might use to come up with something to transmit can be copied and faked by a third party. here is a post with some ideas of how to try to secure a pi running linux",2,security;cryptography;raspberry-pi,2014-02-19
21347598,securing your server from the process of collecting data from insecure machines,"i am using multiple 30 raspberry pi to collect field data and want to send this data to my mysql server. what are the best practices to secure my server as much as possible? should i have the client connect to an intermediary like phpjava that checks a database of usernamespasswords with rate limiting etc, or use fail2ban and connect directly to the mysql server?",,0,mysql;security;database-connection;raspberry-pi,2014-01-25
20613251,ssh to raspberry pi with same ip but interchangeable os?,"i have a raspberry pi which i run with two different operating systems by booting up with different sd cards. this rpi has a static internal ip address and the same iface mac address, as both operating systems have a public ip whenever they are running, allowing me to ssh from work. the problem is that i can only ssh into one operating system given that my knownhosts only recognises one key per host, so i would have to delete each time the knownhosts entry whenever the operating systemsd card changes. ive created two different rsa keys for each system, and on my local machine under .sshconfig given each host an alias and corresponding identifyfile key, but i still come across the same issue. ive also created one key for both system and still come across the same issue. is there any waymethod to ssh into my rpi regardless of the os without having to delete the key each time from knownhosts?",,1,security;ssh;raspberry-pi;ssh-keys,2013-12-16
