source,texte
arduino automation,Arduino Pro Micro and Bluetooth based Home Automation
arduino automation,Table of Contents
arduino automation,Arduino Pro Micro and Bluetooth:
arduino automation,"Arduino Pro Micro and Bluetooth based Home Automation-It has been six months since I designed theArduino Pro Micro, and during this time, I have extensively explored its capabilities by interfacing it with various sensors and breakout boards. I’ve had the pleasure of working with a range of modules, including thePN532 NFC RFID module, theMLX90614 non-contact infrared temperature sensor, and theR557 Capacitive Fingerprint module."
arduino automation,"So far, this journey has been quite rewarding, and I am generally satisfied with the experiments and tests I’ve conducted. However, before considering the Arduino Pro Micro for integration into real-world products, I feel it’s essential to subject it to further testing with additional modules."
arduino automation,"The Arduino Pro Micro has proven to be a versatile and reliable platform, but thorough testing with a variety of modules will help ensure its compatibility and performance in a wider range of applications. Stay tuned as we continue to explore and expand the possibilities of this remarkable microcontroller board. Your support and feedback are invaluable in shaping the future of our projects!"
arduino automation,"Next, in this series I am going to useHC05 or HC06Bluetooth module with the Arduino Pro Micro for controlling 110/220Vac Loads using my custom designed Android Smartphone application designed in Android studio. You can read my article on theAndroid application designingif you want to make a similar android application. You can also watch my video on how to design yourself anArduino pro microusingAltium Designer."
arduino automation,"Anyway, you can see I have connected a 4-channel relay module, HC05 Bluetooth module, and for the demonstration purposes I have connected 220Vac bulbs. I am using my designed5V and 3A power supplyto power up the Arduino Pro Micro. Everything looks good and now let’s power up the project."
arduino automation,"When the 110/220Vac supply is connected never touch the relay contacts as it can be dangerous.  So, as far as possible, wear protective gloves and perform such high voltage experiments in the presence of a companion or someone having basic knowledge of the electrical systems."
arduino automation,"Now, all you need is to take out your cell phone, pair your smartphone’s Bluetooth with the HC05 Bluetooth module."
arduino automation,"Then open the Android application, search for the paired device. Click connect and start controlling anything you want. You can use any android application just send the commands that I have used in the programming."
arduino automation,"As expected, Arduino Pro Micro also works exceptionally well with the Bluetooth. By adding the 5V and 3A power supply, Arduino Pro Micro, Bluetooth module, and 4 relays on a single PCB an amazing end-user product can be designed."
arduino automation,"Now, let’s go ahead and take a look at the connections."
arduino automation,Amazon Links:
arduino automation,HC05 Bluetooth
arduino automation,HC06 Bluetooth module
arduino automation,Arduino Pro Micro
arduino automation,4 Channels relay module
arduino automation,Arduino Nano USB C type (Recommended)
arduino automation,*Please Note: These are affiliate links. I may make a commission if you buy the components through these links. I would appreciate your support in this way!
arduino automation,HC05 or HC06 Bluetooth Module:
arduino automation,"The HC-05 and HC-06 are two common Bluetooth modules used in various electronic projects for wireless communication. They both have similar form factors and capabilities, but there are some differences between them that you should consider when choosing one for your project. Here’s a comparison:"
arduino automation,Bluetooth Versions:
arduino automation,"HC-05: The HC-05 module is based on Bluetooth 2.0+EDR (Enhanced Data Rate), which provides faster data transfer rates compared to the older Bluetooth 1.0 standard."
arduino automation,"HC-06: The HC-06 module is also based on Bluetooth 2.0+EDR, so it has similar Bluetooth capabilities as the HC-05."
arduino automation,Operating Modes:
arduino automation,HC-05: The HC-05 can operate in both Master and Slave modes. This means it can initiate connections with other Bluetooth devices (Master) or accept incoming connections (Slave).
arduino automation,"HC-06: The HC-06 is primarily designed for Slave mode, which means it can only accept incoming connections from other Bluetooth devices. It cannot be used as a Master to initiate connections."
arduino automation,Configuration:
arduino automation,"HC-05: The HC-05 is often considered more versatile because it can be configured to operate in both Master and Slave modes using AT commands. This makes it more suitable for various applications, including establishing point-to-point or point-to-multipoint connections."
arduino automation,"HC-06: The HC-06 is typically set to Slave mode by default and cannot be easily reconfigured to act as a Master. This makes it more suitable for applications where you only need a simple wireless link, like connecting a microcontroller to a smartphone."
arduino automation,Pairing:
arduino automation,"HC-05: The HC-05 can be paired with other Bluetooth devices, allowing secure communication with encryption. This is useful for applications that require data privacy and security."
arduino automation,"HC-06: The HC-06 can also be paired, but it may not support advanced security features to the same extent as the HC-05."
arduino automation,Price:
arduino automation,"HC-06 modules are often cheaper than HC-05 modules, which can be a factor to consider if you are working on a budget."
arduino automation,Use Cases:
arduino automation,"HC-05: It is suitable for applications where you need more control over Bluetooth communication, such as creating a wireless serial link between devices, setting up a Bluetooth-controlled robot, or establishing a Bluetooth data link between two microcontrollers."
arduino automation,"HC-06: It is suitable for simpler applications where you just need a basic wireless connection, such as interfacing with a smartphone app or connecting a microcontroller to Bluetooth headphones."
arduino automation,"In summary, if you need a more versatile module that can operate in both Master and Slave modes and support advanced configuration options, the HC-05 may be the better choice. On the other hand, if you have a simple application that only requires a Slave module for basic wireless communication, the HC-06 may be more cost-effective. Your choice depends on the specific requirements of your project."
arduino automation,Arduino Nano or Arduino Pro Micro:
arduino automation,"The choice between an Arduino Nano and an Arduino Pro Micro depends on the specific requirements of your project. Both boards are popular among makers and developers, but they have some differences in terms of form factor, features, and capabilities. Here’s a comparison to help you decide which one is more suitable for your needs:"
arduino automation,Arduino Nano:
arduino automation,"Form Factor:The Arduino Nano is relatively compact and has a similar form factor to the Arduino Uno. It is a small, breadboard-friendly board, making it easy to prototype and integrate into projects."
arduino automation,"Microcontroller:The Arduino Nano typically uses an ATmega328P microcontroller, which is the same microcontroller used in the Arduino Uno. It has 32KB of Flash memory, 2KB of RAM, and 1KB of EEPROM."
arduino automation,"Voltage Regulator:The Nano often includes a voltage regulator that allows it to be powered from a wide range of voltage sources (usually 7-12V), making it suitable for various power supply options."
arduino automation,"I/O Pins:The Nano provides multiple digital and analog I/O pins for interfacing with sensors, displays, and other components."
arduino automation,"USB Interface:It typically uses a micro-USB connector for programming and power, making it easy to connect to a computer."
arduino automation,Price:Arduino Nano boards are generally affordable and widely available.
arduino automation,Arduino Pro Micro:
arduino automation,Form Factor:The Arduino Pro Micro is smaller and more compact compared to the Nano. It is often used in projects with limited space.
arduino automation,"Microcontroller:The Pro Micro uses various microcontrollers, including the ATmega32U4. This microcontroller has 32KB of Flash memory, 2.5KB of RAM, and 1KB of EEPROM."
arduino automation,"Voltage Regulator:The Pro Micro may not include a voltage regulator by default, which means it typically requires a stable 5V power supply. Some versions of the Pro Micro do have voltage regulators, so check the specific variant you’re using."
arduino automation,"I/O Pins:The Pro Micro provides digital and analog I/O pins, but the number and arrangement of pins may vary depending on the version of the board."
arduino automation,"USB Interface:It uses a micro-USB or mini-USB connector for programming and power, depending on the variant. Some versions also come with a built-in USB-to-Serial converter."
arduino automation,"Price:Arduino Pro Micro boards are generally affordable, but prices may vary depending on the specific version and features."
arduino automation,Considerations:
arduino automation,"If you need a small, compact board for space-constrained projects, the Arduino Pro Micro might be a better choice."
arduino automation,"If you want the versatility of using a wide range of voltage sources and a more standard USB connection, the Arduino Nano is a good option."
arduino automation,"Check the specific requirements of your project, including the required I/O pins, power supply, and microcontroller features, to determine which board is the most suitable."
arduino automation,Arduino Pro Micro & Bluetooth interfacing:
arduino automation,"4 relays are connected to the Arduino Pro Micro digital pins 4, 5, 6, and 7. The VCC and GND pins of the HC05 Bluetooth module are connected to the 5V and GND of the power supply. Connect the TX and RX pins of the HC05 Bluetooth module to the Arduino Pro Micro RX and TX pins respectively."
arduino automation,5V and 3A power supply circuit diagram:
arduino automation,Video Tutorial
arduino automation,Relay circuit diagram:
arduino automation,"Here is a circuit diagram of the one-channel relay module, if you want to make your own relay module."
arduino automation,Arduino Pro Micro & Bluetooth Programming:
arduino automation,"I started off by adding the Arduino.h header file. Next, I defined pins for all the 4 relays which are connected to the Arduino Pro Micro pins 4, 5, 6, and 7."
arduino automation,"Next, I defined a serial port for the HC05 Bluetooth module."
arduino automation,"In the void setup() function, I activated the serial communication and set all the 4 loads as output. Now, let’s go to the loop() function that runs repeatedly."
arduino automation,"Inside the loop() function, I defined a variable of the type string that I am going to use for storing the string which I am going to receive from the Bluetooth module."
arduino automation,"This line means if data is available on the serial port. It’s the data that is sent from the android application. So, if data is available on the serial port then read the complete line and store it in the variable. From the android application I am only going to send the numbers and when these numbers are received by the Arduino, these are stored as a string."
arduino automation,"So, that’s why I am converting it back into integer."
arduino automation,"And then these are if conditions to check the numbers, each number is used to turn ON and turn OFF a specific load. So, that’s all for now."
arduino automation,Watch Video Tutorial:
arduino automation,Engr. Shahzada Fahad
arduino automation,Related Articles
arduino automation,Digital 360° Tilt Sensor with Arduino and ESP32
arduino automation,Underwater Ultrasonic Sensor with Arduino
arduino automation,"Weighing Scale using Arduino, HX711, and a Load Cell"
arduino automation,Force Sensitive Resistor FSR with Arduino
arduino automation,One Comment
arduino automation,How to creat projects
arduino automation,Leave a ReplyCancel reply
arduino automation,Your email address will not be published.Required fields are marked*
arduino automation,Comment*
arduino automation,Name*
arduino automation,Email*
arduino automation,Website
arduino automation,"Save my name, email, and website in this browser for the next time I comment."
arduino automation,Δ
arduino automation,"pH meter Arduino, pH Meter Calibration, DIYMORE pH Sensor Arduino Code"
arduino automation,Arduino Libraries Download and Projects they are used in “Project codes”
arduino automation,"Decoder, 3 to 8 Decoder Block Diagram, Truth Table, and Logic Diagram"
arduino automation,We are using cookies to give you the best experience on our website.
arduino automation,You can find out more about which cookies we are using or switch them off insettings.
arduino automation,This website uses cookies so that we can provide you with the best user experience possible. Cookie information is stored in your browser and performs functions such as recognising you when you return to our website and helping our team to understand which sections of the website you find most interesting and useful.
arduino automation,Strictly Necessary Cookie should be enabled at all times so that we can save your preferences for cookie settings.
arduino automation,"If you disable this cookie, we will not be able to save your preferences. This means that every time you visit this website you will need to enable or disable cookies again."
arduino automation1,"Arduino GSM Module based Home Automation, Sim900A GSM module"
arduino automation1,Table of Contents
arduino automation1,Arduino GSM Module based Home Automation:
arduino automation1,"Arduino GSM Module based Home Automation, Sim900A GSM module-In today’s article, we are going to make the World’s most secured GSM based Home Automation system using Arduino and Sim900a GSM Module. You can use Arduino Nano or Arduino Uno."
arduino automation1,"If I use a simple command like this then anyone can control the home appliances or other highly sensitive loads using their cell phones. Because, there is no check who is sending the control command. An automation system like this is useless if it has no security."
arduino automation1,"So, I came up with an idea of adding a password in the control command."
arduino automation1,"This password can consist of letters, numbers, and special characters. Without a password, nobody would be able to control anything. Because, each time you want to Turn On or Turn OFF a specific load, you will have to enter the password. You can set an extremely strong password and then nobody would be able to control anything. This is the type of GSM based Home Automation that you can totally rely on. Let me demonstrate this for you."
arduino automation1,"For demonstration purposes, I have selected abc123 as the password, then I selected the load, and then 1 or 0 as a control signal to Turn ON or Turn OFF that load."
arduino automation1,"You might have noticed I used percentage sign; I am doing this because when the Arduino receives this message. Then the Arduino can easily split this message using % sign as the delimiter. Anyway, the message is ready, and I am going to send it to the Arduino."
arduino automation1,"This is amazing, isn’t it?"
arduino automation1,"Now, to turn OFF the same load, I will have to type the same control command but this time I am going to send 0 as the control signal to turn OFF the Load1."
arduino automation1,"The same way, I can control Load2 and let me also tell, instead of writing load1 and load2, you can also write the load names, bulb1, bulb2, etc. And if I am going to type a wrong password, nothing is going to happen."
arduino automation1,"I also have this Electronic Door Lock connected to the Arduino. And to control this Lock I am using the same password, but this time instead of using load as the name, I am using the name lock, and 1 or 0 to open or close the Electronic Door Lock."
arduino automation1,"Anyway, I am going to send this message, and let’s see if it’s going to open the Door Lock."
arduino automation1,"Great, I am also able to control the Electronic Lock. Now, you can also build yourself the mostly highly secured Locker. There are more than a million ways you can use this idea. I am sure by now, you might have got an idea of how does this system work. So, without any further delay let’s get started!!!"
arduino automation1,Amazon Links:
arduino automation1,Arduino Nano USB-C Type (Recommended)
arduino automation1,GSM Sim900A Module
arduino automation1,*Disclosure: These are affiliate links. As an Amazon Associate I earn from qualifying purchases.
arduino automation1,Sim900a GSM Module:
arduino automation1,"This is the GSM Sim900A mini Module. The first thing that you will notice about this GSM module is that, it has no onboard voltage regulator, so be very careful while applying the voltage; Because voltages greater than 5 volts can easily damage this module. Ideal voltage for this GSM module is 4.7v but you can easily power up this GSM Sim900A module using a 5v and 2A adaptor. if you don’t have a 5v adaptor then you can make yourself power 5V and 3A power supply. I have a detailed article onhow to build yourself a 5V and 3A power supply."
arduino automation1,There are a few things that I really like about this GSM sim900A module which are
arduino automation1,This is the cheapest GSM module available on the Market.
arduino automation1,"Another cool thing is, it can be easily interfaced with 5V supported controller boards like Arduino Uno, Arduino mega, Arduino Nano etc and also with 3.3v controller boards like Nodemcu ESP8266 Wifi Module and ESP32 etc. The GSM Sim900A module interfacing with Nodemcu ESP8266 and ESP32, I have already explained in my previous videos."
arduino automation1,"Anyway, I have also a detailed article on theGSM Sim900a moduleexplaining its"
arduino automation1,Key features
arduino automation1,Functional diagram
arduino automation1,Pins description
arduino automation1,Its applications
arduino automation1,How to use it
arduino automation1,Its pinout and AT commands.
arduino automation1,"Now, let’s go ahead and take a look at the circuit diagram."
arduino automation1,Arduino GSM Based Home Automation Circuit:
arduino automation1,"As usual, I am using my Arduino Nano and LoRa based development board. This development board has the advantage of having this 5V and 3A power supply which is more than enough to power up the Arduino and the GSM module."
arduino automation1,"This development board also has 5V SPDT type relays. So, this development board is ideal for testing this project. And for now, forget about the onboard LoRa module and the 5V Buzzer. Only concentrate on the connections I am about to explain."
arduino automation1,Connect the power supply pins of the GSM Sim900a module to the regulated 5v and 3A power supply. The 5V and GND wires from the 5V and 3A power supply are connected to the Arduino Vin and Gnd pins.
arduino automation1,Connect the GSM module TXD 5V pin to the Arduino digital pin D9 and connect the RXD 5V pin to the Arduino digital pin D10.
arduino automation1,"The 4 channel relay module connected to the Arduino digital pins 4, 5, 6, and 7. And if you want to make your own relay module then you can follow the circuit diagram given below."
arduino automation1,You can also read my article ondifferent types of relays and how to use them.
arduino automation1,"So, that’s all about the connections. Now, let’s go ahead and take a look at the programming."
arduino automation1,"Altium Designer, Altium 365, & Octopart:"
arduino automation1,"Altium Designer is the world’s most trusted PCB design system. Altium Designer enables engineers to effortlessly connect with every facet of the electronics design process. Over 35 years of innovation and development focused on a truly unified design environment makes it the most widely used PCB design solution. With Altium Designer you can create PCB designs with an intuitive and powerful interface that connects you to every aspect of the electronics design process. Route it your way through any angle, tune for the delay, Push, Slide, and Walkaround faster than ever."
arduino automation1,"Easily work together with your mechanical team and forget about the days of swapping design files. Every design change stays in sync between Altium Designer and SOLIDWORKS, PTC Creo, Autodesk Inventor, Autodesk Fusion 360, or Siemens NX*."
arduino automation1,"Interact and collaborate with mechanical designers like never before in a photo-realistic, 3D design environment."
arduino automation1,"One of the best things about Altium Designer is that you can share your designs with your team members using Altium 365. They can check your design, leave comments, and if there are any issues, they can fix them from anywhere in the world. Altium Designer also uses the world’s fastest components search engine, Octopart, so you won’t have any difficulty in searching for components."
arduino automation1,"Altium Designer,Altium 365, andOctopart—unleashes the full potential of electronics design by seamlessly integrating design tools, collaboration platforms, and component databases. Together, they offer engineers a comprehensive and synchronized experience, leading to improved productivity, reduced errors, and accelerated innovation in the world of electronics design."
arduino automation1,Arduino GSM Based Home Automation Programming:
arduino automation1,"I started off by adding the SoftwareSerial.h header file. With the help of this library I can defined multiple serial ports. As you can see using the SoftwareSerial I have defined another serial port using the Arduino pins 9 and 10. I could also connect the GSM module to the Arduino default Serial port, but I used it for the debugging purposes."
arduino automation1,"4 relays are connected to the Arduino pins 4, 5, 6, and 7."
arduino automation1,"I also defined a variable passcode of the type String, so that I can use a combination of letters, numbers, and characters. So, my password is “abc123”. If I want to change my password then I can simply change this passcode over here."
arduino automation1,I also defined a variable for storing the message.
arduino automation1,"Code in the void setup() function is exactly the same, as used in my previous GSM based security system. So, let’s go to the loop() function."
arduino automation1,"We simply check if a message is received then store the entire string message in the variable incoming, and then using the % sign as the delimiter we split the message, and store the corresponding values in variables password, load, and loadstatus."
arduino automation1,And then I have defined multiple conditions to turn ON and turn OFF the desired loads.
arduino automation1,"The getValue() function is used to split the message using any character as the delimiter. So, that’s all about the programming."
arduino automation1,"For the step by step explanation watch the video tutorial and don’t forget to like, share, and subscribe."
arduino automation1,Watch Video Tutorial:
arduino automation1,Engr. Shahzada Fahad
arduino automation1,Related Articles
arduino automation1,Digital 360° Tilt Sensor with Arduino and ESP32
arduino automation1,Underwater Ultrasonic Sensor with Arduino
arduino automation1,"Weighing Scale using Arduino, HX711, and a Load Cell"
arduino automation1,Force Sensitive Resistor FSR with Arduino
arduino automation1,Leave a ReplyCancel reply
arduino automation1,Your email address will not be published.Required fields are marked*
arduino automation1,Comment*
arduino automation1,Name*
arduino automation1,Email*
arduino automation1,Website
arduino automation1,"Save my name, email, and website in this browser for the next time I comment."
arduino automation1,Δ
arduino automation1,"pH meter Arduino, pH Meter Calibration, DIYMORE pH Sensor Arduino Code"
arduino automation1,Arduino Libraries Download and Projects they are used in “Project codes”
arduino automation1,"Decoder, 3 to 8 Decoder Block Diagram, Truth Table, and Logic Diagram"
arduino automation1,We are using cookies to give you the best experience on our website.
arduino automation1,You can find out more about which cookies we are using or switch them off insettings.
arduino automation1,This website uses cookies so that we can provide you with the best user experience possible. Cookie information is stored in your browser and performs functions such as recognising you when you return to our website and helping our team to understand which sections of the website you find most interesting and useful.
arduino automation1,Strictly Necessary Cookie should be enabled at all times so that we can save your preferences for cookie settings.
arduino automation1,"If you disable this cookie, we will not be able to save your preferences. This means that every time you visit this website you will need to enable or disable cookies again."
arduino automation2,"Arduino and Lora based Automation Project with Feedback message, Lora SX1278"
arduino automation2,LoRa Wireless Range testing
arduino automation2,Table of Contents
arduino automation2,Arduino and Lora based Automation Project:
