source,texte
arduino automation8,*Please Note: These are affiliate links. I may make a commission if you buy the components through these links. I would appreciate your support in this way!
arduino automation8,Human detection:
arduino automation8,Feature
arduino automation8,"Unlike traditional infrared sensors, The C4001Millimeter Wave Presence Sensor utilizes a combination of TOF radar and Doppler radar sensing principles for active detection."
arduino automation8,"It can accurately detect human presence, slight movements, and body motion, making it highly effective for applications requiring precise monitoring."
arduino automation8,"One of its standout features is its adjustable sensing range, allowing customization based on specific needs."
arduino automation8,"Additionally, it has strong resistance to environmental factors, remaining unaffected by temperature changes, heat sources, light variations, and airflow."
arduino automation8,"A key advantage of this sensor is its penetration ability, enabling it to detect human presence through fabric, plastic, glass, and other insulating materials."
arduino automation8,"Moreover, it supports distance measurement, adding versatility to its functionality."
arduino automation8,Installation Methods
arduino automation8,"The performance of a millimeter-wave human body sensor depends on proper installation, as incorrect placement can impact its accuracy and functionality."
arduino automation8,"The commonly used installation methods for this module include top installation, bottom installation, horizontal installation, and downward tilted installation."
arduino automation8,Specifications of C4001 mmWave Sensor:
arduino automation8,The C4001 mmWave presence sensor uses FMCW modulation to measure both distance and speed. It can detect objects up to 12 meters away and track motion speeds ranging from 0.1 to 10 meters per second.
arduino automation8,"The C4001 millimeter-wave human presence sensor operates on a 3.3V or 5V power supply, making it compatible with various microcontrollers."
arduino automation8,Operating Voltage: 3.3V/5V
arduino automation8,Maximum Detection Range: 12m
arduino automation8,Beam Angle: 100*80°
arduino automation8,Modulation Mode: FMCW
arduino automation8,Operating Frequency: 24GHz
arduino automation8,Operating Temperature: -40~85℃
arduino automation8,Baud Rate: 9600
arduino automation8,I2C Address: 0x2A/0x2B
arduino automation8,Size: 22*30mm
arduino automation8,"+ is the Power, – is the Ground, C/R is I2C Clock Line or RX, and D/T is the I2C Data Line or TX."
arduino automation8,It comes with a Gravity-4P I2C/UART Sensor Connector.
arduino automation8,"It features a switch labeled “I2C/UART”, allowing me to toggle between I2C and UART communication based on my setup. Right next to it, there is another switch for selecting the I2C address (0x2A or 0x2B), which is useful when using multiple sensors on the same I2C bus."
arduino automation8,"Right now, I have set it to I2C mode. The advantage of this is that I don’t have to change the pins in the code for Arduino or ESP32. But if I select UART communication, I would have to change the pins every time. So, I will use I2C communication."
arduino automation8,And let me tell you all the programs I am going to share with you will work on both Arduino and ESP32 without any changes.
arduino automation8,Features
arduino automation8,Applications
arduino automation8,C4001 mmWave Sensor with Arduino:
arduino automation8,Connect the Red and Black wires to the Arduino 5V and Gnd. Connect the Blue wire to the Arduino A5 and the other wire to A4 pin on the Arduino. A4 is the SDA and A5 is the SCL.
arduino automation8,The 5V buzzer is connected to the Arduino digital pin 8. For the connections you can follow this circuit diagram.
arduino automation8,"Right now, I can’t permanently fix the C4001 mmWave sensor because I need to perform multiple tests on it. So, that’s why I temporarily attached it to a mobile stand using double tape."
arduino automation8,"And let me tell you; It should be at least 1.5 meters above the floor. Now, let’s go ahead and take a look at the programming."
arduino automation8,Install required library:
arduino automation8,"First, you need to install theDFRobot_C4001 library. To do this, go to the product’swiki pageand download the library from there. I have already downloaded it."
arduino automation8,"Next, go to the Sketch menu…then to Include Library…and clickAdd .ZIP Library."
arduino automation8,"Finally, select the folder and then click the open button."
arduino automation8,Example1:
arduino automation8,I downloaded this code from DFRobot’s Wiki page. You can also find the code for UART communication on the same page.
arduino automation8,"At first glance, this code might look a bit confusing, but it’s actually not that complicated. Once you read through it, you will understand it better. In the next examples, I have simplified the code significantly."
arduino automation8,Code:
arduino automation8,Practical Demonstration:
arduino automation8,"Look at the screen—Target Number, Target Speed, Target Range, and Target Energy—all updating in real-time!"
arduino automation8,"When I move towards the mmWave sensor, the Target Speed value shows a negative sign. But the moment I move away, the negative sign disappears!"
arduino automation8,"From the Target Range value, you can already tell how accurate this sensor is!"
arduino automation8,"And here’s the real game-changer; Target Energy! The more I move, the higher this value goes."
arduino automation8,Example 2:
arduino automation8,"You might have noticed that the values were fluctuating a lot. So this time, we will use a filter to make the values more stable, and along with that, we will also use a timer. We will also define the range to check how accurate the sensor is."
arduino automation8,C4001 Stable Value and Distance Program:
arduino automation8,Code Explanation
arduino automation8,"As you can see, I have simplified the code. The buzzer is connected to digital pin 8."
arduino automation8,"I have also defined a 600ms delay, meaning the buzzer will only turn OFF when no human is detected for 600ms."
arduino automation8,"For now, you can see that I have set the minimum distance to 30cm and the maximum distance to 1200cm (12 meters full range). The threshold value is set to 10. You will understand the C4001 mmWave sensor better when you experiment with different values."
arduino automation8,"Additionally, I have used a filter to stabilize the targetRange value."
arduino automation8,The buzzer will only turn ON if the person’s distance is between 0.4 and 5.0 meters.
arduino automation8,"Otherwise, the buzzer will remain OFF."
arduino automation8,"As you can see, I have used a timer, so the buzzer will turn OFF only when there is no detection for 600ms."
arduino automation8,I have already uploaded this program and now let’s watch the C4001 mmWave sensor in action.
arduino automation8,Practical Demonstration:
arduino automation8,"Right now, I am outside the room, and the buzzer is OFF. Now, I am about to enter the room; let’s see if the buzzer turns ON or not.For practical demonstration watch the video tutorial given at the end of this article."
arduino automation8,Amazing! We have successfully used the C4001 mmWave sensor to turn the buzzer ON. The buzzer will remain ON as long as I stay within the defined range.
arduino automation8,"This, in itself, works as a security system; as soon as someone enters the room, the buzzer turns ON. By using the same code, you can also control lights. In a little while, we will also test it with a light."
arduino automation8,"Now, let’s try a different range."
arduino automation8,I have set the maximum detection range to 300cm (3 meters) and also set the target range to 3 meters.
arduino automation8,"It limited the sensor’s detection range as per our preference. Similarly, you can also set your own custom range as needed."
arduino automation8,"In the next two examples, we will be using the ESP32. So now, it’s your choice whether you want to use an Arduino or the ESP32 WiFi + Bluetooth module."
arduino automation8,C4001 mmWave Sensor with ESP32:
arduino automation8,Connect the Red and Black wires of the C4001 mmWave Sensor to the ESP32’s 3.3V and GND pins.
arduino automation8,Connect the Blue wire to GPIO22 and the other wire to GPIO21.
arduino automation8,The 5V SPDT type relay is connected to the GPIO13. For the relay connections you can follow this circuit diagram.
arduino automation8,"Now, let’s go ahead and take a look at the programming."
arduino automation8,C4001 mmWave ESP32 Relay Program:
arduino automation8,Code Explanation:
arduino automation8,"The relay is connected to GPIO13. To further eliminate fluctuations, this time I am using two timers."
arduino automation8,"We could still use the previous code, but this is another approach where we can control the ON time and adjust the scan time."
arduino automation8,Everything else is almost the same. The main purpose of this example is to demonstrate how to use the C4001 mmWave sensor with the ESP32 and show you how to control a light.
arduino automation8,Practical Demonstration:
arduino automation8,"As you can see while I am outside the Sensor’s range, the light is OFF."
arduino automation8,"This time, the relay didn’t turn ON instantly. First, the C4001 mmWave sensor detected my presence for a few seconds, and only then did it turn the relay ON."
arduino automation8,"Now, the light will remain ON as long as I stay in this area."
arduino automation8,"When I leave the area, the C4001 mmWave sensor will scan the area for a few seconds, and if no movement is detected, it will turn the light OFF."
arduino automation8,"Now, it’s your choice whether you want to use the buzzer-based code or this one."
arduino automation8,C4001 mmWave with ESP32 & Blynk:
arduino automation8,"Next, we will use theC4001 mmWave sensorwith theBlynk application. With Blynk, we can monitor theC4001 sensorfrom anywhere in the world."
arduino automation8,"In my previous article and video, I set upBlynk for a Tilt sensor, and I will be using the same application for this project."
arduino automation8,"As you can see, I have named the device C4001 mmWave."
arduino automation8,"If I go to Datastreams, you will see that I am using the same virtual pin V0, but this time, I have changed its Data Type to Double."
arduino automation8,"That’s it! If you still find it difficult, I recommend watching my previous video on the 360-degree Tilt sensor or you can also read the article."
arduino automation8,"If I open the ESP32 code, you will see that I am using the same Template name, ID, and authorization token."
arduino automation8,"I have also included a watchdog timer, so you won’t need to manually restart the ESP32 if it freezes."
arduino automation8,"The rest of the code is simple and straightforward. If you read it carefully, you will understand it easily."
arduino automation8,"And if you are using ESP32 and Blynk for the first time, I highly recommend watching my getting started video onESP32 and Blynk V2.0."
arduino automation8,Practical Demonstration:
arduino automation8,"With the Blynk application, I can now monitor the C4001 mmWave sensor in real time from anywhere in the world."
arduino automation8,"You can build a highly reliable security system that you can monitor from your Smartphone. And if you have a paid Blynk plan, you can even generate alert messages."
arduino automation8,"By now, you should have a good idea of how easily the C4001 mmWave sensor can be used with Arduino and ESP32."
arduino automation8,Tests on C4001 mmWave Sensor:
arduino automation8,"Now, we are going to perform some tests, and after that, you can decide for yourself whether you should use the C4001 mmWave sensor or not."
arduino automation8,Cardboard Box:
arduino automation8,"First, I am going to start with this cardboard box, and then we will gradually increase the complexity. I am using my4S Lithium Ion battery packto power up the Arduino Nano Development board."
arduino automation8,"So, let’s see if it can detect me."
arduino automation8,It detected me so easily from inside the box. I didn’t stop here. I put three more boxes in front of it; and it still detected me without any issues.
arduino automation8,"This is crazy! I can’t stop myself from testing one more Box, but this time I am going to do something different."
arduino automation8,"Finally, this giant box! Inside this box, there’s a dinner set “a lot of stuff inside”. Let’s see if theC4001can still detect me through all these five boxes."
arduino automation8,"The range has reduced, likely because there’s a lot of stuff inside the box. When I’m close to the table, it detects me perfectly, but as I step back, the C4001 can’t detect me anymore. The first test was super impressive!"
arduino automation8,Human Detection through Hardboard:
arduino automation8,"Next up, we are taking the challenge to the next level—testing it with this hardboard sheet! The sensor is facing downward, and the real question is… can it detect my foot movement through the board? This could be a game-changer for hidden security and smart automation! Let’s find out!"
arduino automation8,"It was like a piece of cake for the C4001 mmWave Sensor. This is so incredible, we can use it inside Drawers to protect Jewelry, money, etc from being stolen."
arduino automation8,C4001 mmWave Sensor Detection throughGlass:
arduino automation8,Can the C4001 mmWave sensor detect me through glass? This could be a game-changer for security systems in shops and offices! But here’s the real challenge—I haven’t placed it directly against the glass. I left some distance to truly push its limits. Will it pass or fail? Let’s find out!
arduino automation8,This is absolutely mind blowing. I didn’t see any change in the range. You can use this behind a mirror in a Washroom/Bathroom to control the lights automatically. Hundreds of ideas are popping up in my mind. What’s in your mind? Let me know in the comment.
arduino automation8,Human Detection through Plastic:
arduino automation8,"This time, I have placed a plastic case in front of the mmWave sensor. I’m sure it won’t have any trouble penetrating it and detecting my presence."
arduino automation8,"It detected me as if there is nothing in front of the C4001 mmWave sensor. From this test its obvious that we can use it in any plastic enclosure, this way we can make it waterproofed and then we can use it outside for security purposes or for controlling lights. There are more than a thousand ways it can be used. So, it’s up to you; how you plan to use it. Best of Luck!"
arduino automation8,Human Detection through Curtains “Fabric”:
arduino automation8,Can this mmWave sensor see through a curtain?
arduino automation8,There’s quite a distance between the sensor and the curtain; so let’s put the C4001 mmWave to the test. Will it detect me even when I am completely hidden?
arduino automation8,"Just imagine… A sensor so powerful that it can detect movement without even seeing you! This could change the game for security systems, smart automation, and even futuristic tech!"
arduino automation8,Let’s find out!
arduino automation8,"This is absolutely mind blowing; This tiny sensor just proved; it can detect movement through fabric! Imagine the possibilities—security systems, hidden monitoring, and more! What would you use this for? Let me know in the comments!"
arduino automation8,Detection through a Wood door:
arduino automation8,Can the C4001 mmWave Sensor penetrate this door and still detect me on the other side?
arduino automation8,"If it detects me, I’ll be seriously impressed!"
arduino automation8,"As you can see, the sensor is quite far from the door. The real question is—can it still penetrate through and detect me on the other side? Let’s find out!"
arduino automation8,"The C4001 mmWave sensor just shocked me! Even from a distance, it successfully detected my presence through the door!"
arduino automation8,"Now imagine the possibilities; you can detect if someone is standing outside your room, create a contactless doorbell, or even build a completely invisible security system!"
arduino automation8,mmWave Sensor under a Fan:
arduino automation8,Can It Survive Under a Ceiling Fan?
arduino automation8,Many people complain that mmWave sensors struggle under direct airflow; so let’s put that to the test!
arduino automation8,"The C4001 mmWave sensor is right under a running ceiling fan; the airflow is strong, and if this sensor is truly reliable, it should still detect me without false triggers."
arduino automation8,"So what’s going to happen? Will it detect me accurately, or will the airflow confuse it? Let’s find out!"
arduino automation8,"Drop your predictions in the comments before we begin! Do you think this sensor can handle it, or will it fail?"
arduino automation8,"The fan is running at full speed, and I am standing outside the sensor’s range. The buzzer has been OFF for the last 3 minutes—no false triggering at all!"
arduino automation8,But now comes the real challenge!
arduino automation8,I am about to step closer to the C4001 mmWave sensor—will it detect me accurately despite the strong airflow? Or will it fail like most other mmWave sensors? Let’s find out!
arduino automation8,"This is unbelievable! Most mmWave sensors struggle under direct air contact, but the C4001 is rock solid! This sensor is on a whole new level!"
arduino automation8,C4001 mmWave Sensor Detection through a Wall:
arduino automation8,The Ultimate Challenge:
arduino automation8,Can this mmWave Sensor Detect through Walls?
arduino automation8,We have tested it through curtains… We have tested it through a Door… we have tested it under a running ceiling fan… but now comes the final and most insane test yet;human detection behind a wall!
arduino automation8,I am going to step behind this wall; behind this hardboard sheet is a brick wall. Let’s see if the C4001 mmWave sensor can still detect me.
arduino automation8,It’s NOT detecting me!
arduino automation8,"So, here is the reality; the C4001 mmWave sensor works great through most of the materials, but it struggles with solid walls. This is something you should definitely keep in mind when using it for security applications."
arduino automation8,"Not all mmWave sensors are the same—some are built for ultra-penetration, while others are designed for short-range detection. So, always test before you build!"
arduino automation8,Well if you are specifically looking for a sensor that can detect humans behind a wall then you should read my article on aMicrowave sensorthat can detect Humans behind the walls.
arduino automation8,"So, that’s all for now."
arduino automation8,Support me onPatreonfor more articles and videos.
arduino automation8,Watch Video Tutorial:
arduino automation8,Engr. Shahzada Fahad
arduino automation8,Related Articles
arduino automation8,ESP32-S3 Geek and Arduino IDE- Getting Started Tutorial
arduino automation8,Digital 360° Tilt Sensor with Arduino and ESP32
arduino automation8,SmartWatch Home Automation and Sensor Monitoring
arduino automation8,Smart Staircase Lighting with ESP32 and mmWave Sensor | Motion-Activated LED Strip
arduino automation8,Leave a ReplyCancel reply
arduino automation8,Your email address will not be published.Required fields are marked*
arduino automation8,Comment*
arduino automation8,Name*
arduino automation8,Email*
arduino automation8,Website
arduino automation8,"Save my name, email, and website in this browser for the next time I comment."
arduino automation8,Δ
arduino automation8,"pH meter Arduino, pH Meter Calibration, DIYMORE pH Sensor Arduino Code"
arduino automation8,Arduino Libraries Download and Projects they are used in “Project codes”
arduino automation8,"Decoder, 3 to 8 Decoder Block Diagram, Truth Table, and Logic Diagram"
arduino automation8,We are using cookies to give you the best experience on our website.
arduino automation8,You can find out more about which cookies we are using or switch them off insettings.
arduino automation8,This website uses cookies so that we can provide you with the best user experience possible. Cookie information is stored in your browser and performs functions such as recognising you when you return to our website and helping our team to understand which sections of the website you find most interesting and useful.
arduino automation8,Strictly Necessary Cookie should be enabled at all times so that we can save your preferences for cookie settings.
arduino automation8,"If you disable this cookie, we will not be able to save your preferences. This means that every time you visit this website you will need to enable or disable cookies again."
arduino logs1,"Arduino Hydroponics, DIY Hydroponics System using pH Sensor & EC Sensor, Hydroponic"
arduino logs1,Table of Contents
arduino logs1,"Hydroponics System, Description:"
arduino logs1,"Hydroponics is a branch of hydroculture. It is the process of cultivating plants without soil. The plants receive nourishment through mineral nutrients dissolved in water, instead of soil. In my previous tutorial, I have already explained how to monitor the soil nutrients like Nitrogen, phosphorus, and Potassium using theNPK Sensor,Arduino, and anAndroid cell phone application. Besides this, I have also explained explained how to monitor theSoil pH Value, Humidity, and temperature."
arduino logs1,"Read our latest article on “ESP32 Hydroponic System using pH Sensor, EC Sensor, A02YYUW Waterproof Ultrasonic Sensor, DS18B20 waterproof one-wire digital temperature sensor, and Blynk application“."
arduino logs1,"Hydroponics is basically growing plants without soil. It is a more efficient way to provide food and water to your plants. Plants don’t use soil – they use the food and water that are in the soil. Soil’s function is to supply plants nutrients and to anchor the plants’ roots. Hydroponic gardeners may use different types of inert media to support the plants, such as rockwool, coconut fibre, river rock, Styrofoam, or clay pellets."
arduino logs1,"Hydroponics is a Latin word meaning “working water.” In the absence of soil, water goes to work providing nutrients, hydration, and oxygen to plant life. From watermelons to jalapeños to orchids, plants flourish under the careful regimen of hydroponics. Using minimal space, 90% less water than traditional agriculture, and ingenious design, hydroponic gardens grow beautiful fruits and flowers in half the time. If you want to study more about the Hydroponics system then I highly recommend read theFresh Water Systemsarticle."
arduino logs1,"Hydroponic makes it easier to measure and fill the exact amounts of nutrients in the water solutions, since each plant requires different nutrients. This can be really a tedious job if you do it manually. Well, I am not a Hydroponics expert and I really don’t know how much nutrients should be added in the water solution. But I can help you in designing and making your own Hydroponics system which you can use to measure and fill the exact amount of nutrients in the water using Solenoid valves which can be controlled as per the measured values."
arduino logs1,"So, this article is all about how to make your own Hydroponics system using Arduino,pH Sensor,EC sensor or TDS meter,DS18b20 one-wire digital temperature sensor,TOF10120 Laser distance Rangefinder, and anOled display Module."
arduino logs1,"Before, making the final PCB I started with the Arduino Nano Development board and breadboard to perform my initial tests."
arduino logs1,"This is the analog pH sensor kit from theDIYMORE, which needs to be properly calibrated before you can use it for measuring the pH values of different liquids. The pH sensor calibration I have already explained in my previous article “Ph Meter with Arduino and Calibration”. Although the DIYMore is a good pH sensor, but recently the DFRobot has launched a newpH Sensorand it can be used with 3.3V and 5V compatible controller boards.  I have tested it with Arduino and also with the ESP32."
arduino logs1,"I started off by connecting the pH sensor Probe with the Interface circuit. Next, I connected the Red wire with the V+ pin of the interface circuit. Black wire with the GND pin and the Yellow wire with the Po pin of the interface circuit. Finally, I connected the Red wire with the Arduino’s 3.3V, Black wire with the GND pin of the Arduino, and the Yellow wire with the Analog pin A0."
arduino logs1,"This is the EC Sensor or TDS meter V1.0 from the DFrobot which is completely compatible with Arduino. One thing that I really like about this TDS Meter is that it supports 3.3 to 5.5 Volts wide voltage input, and 0 to 2.3 Volts analog voltage output, which makes this TDS meter compatible with 5V and 3.3V control systems or boards. I have very detailed tutorials on the TDS or EC sensor in which I have explained how to use it withArduinoandESP32for monitoring the water quality."
arduino logs1,"The TDS meter is connected with the Arduino or any other controller board using the A, +, and – pins as you can see in the image given above. For the easy interfacing I connected male to male type jumper wires."
arduino logs1,"Connect the + pin of the TDS meter with 3.3V. Connect the Minus pin with the GND of the Arduino, and finally, connect the A pin of the TDS or EC sensor with the A1 pin of the Arduino."
arduino logs1,"This is the DS18b20 One-Wire digital temperature sensor, I have already soldered a 10k resistor and some jumper wires as per the circuit diagram which I will explain later in this article."
