source,texte
arduino automation2,I have modified the code and you can see I have also added a display on the transmitter side. I will display the status of electrical loads on this display. So let us power up the transmitter side and see how this system works.
arduino automation2,"Now, Arduino and Lora-based automation systems present quite a practical look. Whenever I turn ON/OFF any button on the transmitter side, the receiver side sends me feedback on whether that load has turned ON or not."
arduino automation2,"Now even if I do not see electrical appliances or loads, there is no problem, because I keep on receiving feedback from the receiver’s side. Now, if there is some issue on the receiver side, I’ll not receive any kind of feedback. Or if I get out of the range, even then I’ll receive no feedback."
arduino automation2,"Anyways, I have been testing this project for the last two days and it is working exceptionally well."
arduino automation2,"If you are thinking about its real implementation, do not forget to use the watchdog timer on the receiver side. Because with the help of a watchdog timer, you can restart the receiver side Arduino automatically, if it hangs due to any particular reason."
arduino automation2,Tested Range:
arduino automation2,"You can see my brother is standing on the roof of my maternal uncle’s house. He has the transmitter and as you can see he is controlling these light bulbs from there. The distance between the transmitter and receiver is 118 meters. Over such a long-distance still, we were able to control the bulbs. You can also watch this in the video given at the end of this article. The maximum communication distance may be more, even more than 200 meters. I will test the maximum communication distance in some open fields, as I am planning to make a transmitter for one of my upcoming RC Airplane projects."
arduino automation2,"I am sure by now you might have got an idea of how does this system works. So, without any further delay, let’s get started!!!"
arduino automation2,Amazon Links:
arduino automation2,Arduino Uno
arduino automation2,Arduino Nano USB-C Type (Recommended)
arduino automation2,LoRa SX1278 Module
arduino automation2,SSD1306 128×64 Oled i2c display Module
arduino automation2,*Disclosure: These are affiliate links. As an Amazon Associate I earn from qualifying purchases.
arduino automation2,SX1278 Lora:
arduino automation2,"Lora 1278 long-distance wireless transceiver module integrates Semtech RF transceiver chip SX1278, which adopts LoRa TM Spread Spectrum modulation frequency hopping technique. The features of long-distance and high sensitivity (-139dBm) make this module perform better than FSK and GFSK modules. Multi-signal won’t affect each other even in a crowd frequency environment; it comes with strong anti-interference performance. This module is 100mW and ultra-small size, widely used in AMR, remote industrial control filed."
arduino automation2,Features:
arduino automation2,Applications:
arduino automation2,"Arduino Lora Automation Project, Circuit Diagram:"
arduino automation2,Lora Transmitter Circuit Diagram:
arduino automation2,The VCC of the LoRa module is connected with the 3.3V of the Arduino. The MISO Pin of the LoRa module is connected with the Arduino’s pin 12. The MOSI pin is connected with the Arduino’s pin 11. The SCLK pin of the LoRa module is connected with the Arduino’s pin 13. The NSS pin is connected with the Arduino’s pin 10 and the ground pin of the LoRa module is connected with the Arduino’s GND.
arduino automation2,"4 switches are connected with the Arduino pins 2, 3, 4, and 5."
arduino automation2,SSD1306 Oled display module SCL and SDA pins are connected with the Arduino’s A5 and A4 pins.
arduino automation2,On the left side is the regulated 5V power supply which accepts a wide range of input DC voltages between 7 and 28volts.
arduino automation2,Lora Receiver Circuit Diagram:
arduino automation2,"On the receiver side, a 4-channel relay module is connected with the Arduino pins 2, 3, 4, and 5. While the connections of the SX1278 Lora module remain exactly the same. Now, let’s take a look at the Transmitter and Receiver side programming."
arduino automation2,"Arduino Lora Automation Project, Programming:"
arduino automation2,This project is based on two programs. Download the following libraries.
arduino automation2,Download: LoRa.h
arduino automation2,Download: Adafruit_GFX.h
arduino automation2,Download: Adafruit_SSD1306.h
arduino automation2,Lora Transmitter programming:
arduino automation2,I added the Adafruit_GFX and Adafruit_SSD1306 libraries for the Oled display module. You can download these libraries from my article.
arduino automation2,"Next, I defined the localAddress, destination, and these variables for the timer."
arduino automation2,"Next, I defined 4 switches."
arduino automation2,"Next, I defined these 4 variables for storing the status of all the 4 switches in the form of 0 and 1. We use these status values to control relays on the receiver side."
arduino automation2,"Next, I defined these 4 variables to store the status feedback values of the 4 loads received from the receiver side. Now, let’s go to the loop function."
arduino automation2,"First, we read the status of the switches, then we make a complete message and send it to the receiver side. Arduino checks and sends the control commands after every few milliseconds. If you want you can change the interval. After sending the message then the Arduino checks if any data is received from the receiver side."
arduino automation2,"The data which is received from the receiver side is the feedback message, this feedback message consists of the relays status in the form 0 and 1. So, the incoming message is split and the feedback status values are stored in their respective variables, where its values are displayed on the Oled display module."
arduino automation2,"The getValue() function is used to split a string message using a delimiter. In my case, I am using Comma as the delimiter, if you want you can use any other character as the delimiter. So, that’s all about the transmitter side programming, and now let’s take a look at the receiver side programming."
arduino automation2,Lora Receiver Programming:
arduino automation2,"On the receiver side, I am using the same libraries, addresses, and timer intervals."
arduino automation2,"This time I also defined these 4 flags, I am using these flags to stop the unnecessary repetition of code."
arduino automation2,"Next, you can see I also defined pins for the 4 relays."
arduino automation2,"Next, I defined these 4 variables for storing the control commands received from the transmitter. These control commands are used to control all the 4 relays."
arduino automation2,"Finally, I am using these 4 variables to store the status of all the 4 relays. These values are used to create the feedback message which is sent to the transmitter side. Now, let’s go to the loop function."
arduino automation2,"Now, this time I am reading the status of all the four relays, then we create a complete message, which is the feedback message and send it to the transmitter side."
arduino automation2,"Then the Arduino checks if any data is received. This time the received message consists of the control commands which are received from the Transmitter. The Arduino splits the entire message and then using the if conditions the relays are turned ON or turned OFF depending on the received values. So, that’s all about the programming."
arduino automation2,Watch Video Tutorial:
arduino automation2,Engr. Shahzada Fahad
arduino automation2,Related Articles
arduino automation2,Digital 360° Tilt Sensor with Arduino and ESP32
arduino automation2,Underwater Ultrasonic Sensor with Arduino
arduino automation2,"Weighing Scale using Arduino, HX711, and a Load Cell"
arduino automation2,Force Sensitive Resistor FSR with Arduino
arduino automation2,2 Comments
arduino automation2,"Great project, just one question can I use the Arduino Nano for both tx and rx?"
arduino automation2,"Friend, tell me how you can use LEDs instead of a display, how to do it, tell me"
arduino automation2,Leave a ReplyCancel reply
arduino automation2,Your email address will not be published.Required fields are marked*
arduino automation2,Comment*
arduino automation2,Name*
arduino automation2,Email*
arduino automation2,Website
arduino automation2,"Save my name, email, and website in this browser for the next time I comment."
arduino automation2,Δ
arduino automation2,"pH meter Arduino, pH Meter Calibration, DIYMORE pH Sensor Arduino Code"
arduino automation2,Arduino Libraries Download and Projects they are used in “Project codes”
arduino automation2,"Decoder, 3 to 8 Decoder Block Diagram, Truth Table, and Logic Diagram"
arduino automation2,We are using cookies to give you the best experience on our website.
arduino automation2,You can find out more about which cookies we are using or switch them off insettings.
arduino automation2,This website uses cookies so that we can provide you with the best user experience possible. Cookie information is stored in your browser and performs functions such as recognising you when you return to our website and helping our team to understand which sections of the website you find most interesting and useful.
arduino automation2,Strictly Necessary Cookie should be enabled at all times so that we can save your preferences for cookie settings.
arduino automation2,"If you disable this cookie, we will not be able to save your preferences. This means that every time you visit this website you will need to enable or disable cookies again."
arduino automation3,Arduino IoT Cloud Home Automation Project using ESP32
arduino automation3,Table of Contents
arduino automation3,"Arduino IoT Cloud Home Automation, Description:"
arduino automation3,"Arduino IoT Cloud Home Automation Project using ESP32-Building a Home Automation system with Arduino IoT Cloud is far easier than building it with theBlynk IoT platform. A dashboard on your cell phone is automatically generated which you can use to control things from remote locations if you have access to the internet. TheArduino IoT Cloud Remote Appcan be installed on bothIoSandAndroid cell phones. You can also control your electrical devices through a dashboard from your computer screen, now the computer dashboard can be quite handy in situations when you have to monitor and control multiple things."
arduino automation3,"As you can see when I turn ON a button on my computer dashboard, the same button is also turned ON, on the cell phone dashboard. The computer dashboard and cell phone App are working together and make a dual control system which means any electrical device that is turned ON or turned OFF using the computer dashboard can also be turned OFF or turned ON using the cell phone. In this article, you will learn how to makeHome Automation systemusingArduino IoT cloudandESP32WiFi + Bluetooth module."
arduino automation3,Altium Designer:
arduino automation3,"Altium Designeris the world’s most trusted PCB design system.Altium Designerenables engineers to effortlessly connect with everyfacetof the electronics design process. Over 35 years of innovation and development focused on a truly unified design environment makes it the most widely used PCB design solution. WithAltium Designeryou can create PCB designs with anintuitiveand powerful interface that connects you to every aspect of the electronics design process. Route it your way through any angle, tune for delay, Push, Slide, and Walkaround faster than ever. Interact andcollaboratewith mechanical designers like never before in a photo-realistic, 3D design environment. If you want to get started with the Altium designer, you can click on theget started."
arduino automation3,"In my previous article, I explainedhow to get started with the Arduino IoT Cloudand explained the maximum basic things including how to register an account, how to install the ArduinoCreateAgent, how to make a dashboard, and how to write a basic program for monitoring a sensor and for controlling an LED. So, I highly recommend reading my previous getting started tutorial on theArduino IoT Cloud. Without any further delay, let’s get started!!!"
arduino automation3,Amazon Purchase Links:
arduino automation3,12v Adaptor:
arduino automation3,ESP32 WiFi + Bluetooth Module(Recommended)
arduino automation3,12V SPDT Relay:
arduino automation3,*Disclosure: These are affiliate links. As an Amazon Associate I earn from qualifying purchases.
arduino automation3,ESP32 Home Automation Circuit Diagram:
arduino automation3,"J1 is the female power jack and this is where we connect a 12v adaptor, battery, or solar panel. Two 470uf decoupling capacitors are connected at the input and output sides of the 7805 voltage regulator. The output of the voltage regulator is connected with the 5v pin of the ESP32 module and the ground of the power supply is connected with the ground of the ESP32 module."
arduino automation3,"These are 12v SPDT type relays and cannot be directly controlled using the ESP32 Module, So, that’s why we need a driver to control these relays. You can use a relay driver IC or you can use a 2n2222 NPN transistor and a 10k resistor. One pin of the relay coil is connected with the collector of the 2n2222 NPN transistor while the other pin of the relay coil is connected with the 12 volts. The emitter of the transistor is connected with the ground while the base is connected with the 10k ohm resistor."
arduino automation3,"Now to control these relays you simply need to connect these 10k resistors with the ESP32 I/O pins. In this project, I am using the GPIO pins 13, 12, 14, and 27. I will be using the same pins in the programming."
arduino automation3,These 4 relays can be used to control 4 different types of loads. The loads should be connected with thecommonandnormally openlegs of the relays. For the making watch my video tutorial on theESP32 & Blynk application based Home Automation Project.
arduino automation3,"Here is my ESP32 Development board which can be used for monitoring different sensors and controlling different DC and AC loads. If you want to make the same development board then you can download theGerber files. Now, let’s start with the Arduino IoT Cloud. As I have already explained all the steps in my previous getting started tutorial, so there is nothing left to talk about, but still, if you find anything difficult to understand then you can read my article available on www.electroniclinic.com I will provide a link in the description."
arduino automation3,Arduino IoT Cloud Home Automation:
arduino automation3,"To get started with the Arduino IoT Cloud, first, you will need to create an account, which I have already explained in mygetting started tutorial on the Arduino IoT Cloud."
arduino automation3,If you have already an account click on theIOT Cloud.
arduino automation3,"Now, click on theCREATE THINGin which we will create the variables for the various devices."
arduino automation3,Creating variables:
arduino automation3,"Now we will create variables in our case we are using four variables through which we will control four appliances. So, to add the variables click on the add variable, we will go to the setup in which we will click on theADD VARIABLE."
arduino automation3,"Now, first of all, we will create a variable for the first appliance with the name of device1 then in the select variable type, we will select the Alexa compatible in which we will select the switch."
arduino automation3,Then we will click on the add variable.
arduino automation3,"In a similar way, we will add a second variable and give it a name device2"
arduino automation3,Then we will add a third variable for the third appliance.
arduino automation3,"Finally, we will add a fourth variable for the fourth appliance."
arduino automation3,"Now, all the variables have been added and now we will configure the device"
arduino automation3,Configuring the device:
arduino automation3,Now to add the device click on the add device.
arduino automation3,Now we will select the device which we will want to add we will select the third party device
arduino automation3,"After that, we will select theESP32 deviceand select theESP32 dev moduleand click on the continue button."
arduino automation3,Now give a name to the device which isESP32and click on the Next button.
arduino automation3,Then we will click on the download button in order to use the security key and device id.
arduino automation3,"Then click on the, I saved my device and secret key and click on the continue button."
arduino automation3,After clicking on the continue button theESP32 modulewill be successfully added and click on the done button.
arduino automation3,Configuring the network:
arduino automation3,"Now after that, we will configure the network in order to connect to the wifi, we will click on the network button."
arduino automation3,When we will click on the network we will add the name of the wifi router and password. Then copy the secret key from the downloaded pdf and paste it in the secret key box and click on the save.
arduino automation3,"Arduino IoT Cloud Dashboard, Creating buttons:"
arduino automation3,After that click on the dashboards in order to design the various button for controlling the appliances.
arduino automation3,Now click on the edit button and give the name to the project which is home automation.
arduino automation3,Then click on the add button in which we will click on the switch.
arduino automation3,Now give a name to the switch as device 1 and click on the link button
arduino automation3,When we will click on the link button we will select the variable and click on the link button and the button will be linked to the variable.
arduino automation3,"In a similar way, we will add the buttons for the other three appliances and link the variable for each appliance."
arduino automation3,"After that, we will click on the thing and go back to the menu in order to write the code for each appliance. Now click on the sketch button in order to write the code"
arduino automation3,Now click on the open full editor button to write the code
arduino automation3,Arduino IoT Complete code:
arduino automation3,Uploading the code:
arduino automation3,After writing the code we will get a message to install Arduino agent in order to upload the code to the ESP32 so we will click on the learn more and download the agent and install it in the computer.
arduino automation3,This option shows that the agent is running on the computer
arduino automation3,Then we will select the board and click on the ok button.
arduino automation3,Now the board is successfully added and we will click on the upload button
arduino automation3,After uploading the code to the esp32 we will be able to control the appliances from the mobile dashboard and also from the Laptop dashboard.
arduino automation3,Video Tutorial:
arduino automation3,Engr. Shahzada Fahad
arduino automation3,Related Articles
arduino automation3,C4001 mmWave Human Detection Sensor with Arduino and ESP32
arduino automation3,ESP32-S3 Geek and Arduino IDE- Getting Started Tutorial
arduino automation3,Digital 360° Tilt Sensor with Arduino and ESP32
arduino automation3,SmartWatch Home Automation and Sensor Monitoring
arduino automation3,Leave a ReplyCancel reply
arduino automation3,Your email address will not be published.Required fields are marked*
arduino automation3,Comment*
arduino automation3,Name*
arduino automation3,Email*
arduino automation3,Website
arduino automation3,"Save my name, email, and website in this browser for the next time I comment."
arduino automation3,Δ
arduino automation3,"pH meter Arduino, pH Meter Calibration, DIYMORE pH Sensor Arduino Code"
arduino automation3,Arduino Libraries Download and Projects they are used in “Project codes”
arduino automation3,"Decoder, 3 to 8 Decoder Block Diagram, Truth Table, and Logic Diagram"
arduino automation3,We are using cookies to give you the best experience on our website.
arduino automation3,You can find out more about which cookies we are using or switch them off insettings.
arduino automation3,This website uses cookies so that we can provide you with the best user experience possible. Cookie information is stored in your browser and performs functions such as recognising you when you return to our website and helping our team to understand which sections of the website you find most interesting and useful.
arduino automation3,Strictly Necessary Cookie should be enabled at all times so that we can save your preferences for cookie settings.
arduino automation3,"If you disable this cookie, we will not be able to save your preferences. This means that every time you visit this website you will need to enable or disable cookies again."
arduino automation4,Home Automation System using Matlab GUI and Arduino
arduino automation4,Table of Contents
arduino automation4,"Home automation system, Overview:"
arduino automation4,"Home Automation System using Matlab GUI and Arduino-I have been making different types of Home automation and industrial automation projects using different types of controller boards including Arduino Uno, Arduino Nano, Arduino Mega, ESP8266, ESP32 WiFi + Bluetooth Module, Raspberry Pi, and PLC. Below is the list of some of my automation projects which I believe will really help you in making intermediate and advanced level Home automation projects."
arduino automation4,"In this tutorial, we will design a GUI “Graphical User Interface” application in Matlab for controlling different Home appliances like a fan, TV, motor, and lights. You can increase the number of appliances according to your requirement. This project is based on the Matlab and Arduino Uno. First you will need to do some settings before you can send the control commands from theMatlab GUIto theArduino Unoboard. So, if you are using theArduino and Matlabfor the first time then you should read my previous articles on the Matlab."
arduino automation4,"So, after reading the above articles and after installing theHardware support packagefor the Arduino then you are good to go."
arduino automation4,Amazon Links:
arduino automation4,Arduino Uno
arduino automation4,5v relay module
arduino automation4,Other Tools and Components:
arduino automation4,Top Arduino Sensors:
arduino automation4,Super Starter kit for Beginners
arduino automation4,Digital Oscilloscopes
arduino automation4,Variable Supply
arduino automation4,Digital Multimeter
arduino automation4,Soldering iron kits
arduino automation4,PCB small portable drill machines
arduino automation4,*Please Note: These are affiliate links. I may make a commission if you buy the components through these links. I would appreciate your support in this way!
arduino automation4,Circuit diagram of Matlab home automation Project:
arduino automation4,The circuit diagram of the Home automation project is pretty simple. As you can see the neutral wire is connected with all the devices. While the 110/220Vac phase wire is connected with the Common contact of all the relays. The relay is a mechanical switch which we will use to connect and disconnect the Live wire.
arduino automation4,You can also use a 12V relay module for which you will need 12Vdc power supply.
arduino automation4,Note: Be very careful while working on such high voltage system because it can be really dangerous. Don’t forget to wear protective gloves.
arduino automation4,Matlab GUI Design for Home Automation:
arduino automation4,"In order to make the Matlab GUI application, we will write guide in the command window in the MATLAB."
arduino automation4,When we will press enter the GUI platform will open.
arduino automation4,First of all we will insert a panel by clicking on the panel icon:
arduino automation4,"Then we will change the color of the panel and also change the title. In order to change the color double click on the panel, a dialog box will open. Now click on the background color and select the color."
arduino automation4,Now will need several buttons for ON and OFF for various appliances such as:
arduino automation4,"When we will press the FAN ON, the fan will turn ON and when we will press on the FAN OFF the fan will turn OFF and so on."
arduino automation4,"After adding these Push Buttons, the next step is to change the tag for each button and we will also need to change the title of the button. For example, for the FAN ON, we will change the title of the pushbutton to FAN ON and tag to FANON. So, you will need to repeat this for all the buttons."
arduino automation4,Now as our project GUI is complete now we will save the project. After saving the project. the code will automatically open.
arduino automation4,Matlab Home Automation code:
arduino automation4,First of all in the main function we will declare a variable which will get the value of the Arduino port. We declare the “a” variable as a global which means that it is accessible to all functions and the clear all function will clear all the previous values.
arduino automation4,Now for each button we will write the code:
arduino automation4,Fan button function:
arduino automation4,When we click the fan on button the following function will be called:
arduino automation4,Now in this function we will make digital pin 1 of the Arduino “1” which means that it will turn on the fan.
arduino automation4,Now when we will click the off button then we will write 0 to the digital pin 1 which will make the fan turn off.
arduino automation4,Light button function:
arduino automation4,Similarly we have connected light to digital pin 2 of the Arduino. when we will click the light button on the lighton function will be called in which we have make the digital pin high due to which the light will be turn on.
